{
  "schema_version": "1.0",
  "scenario_id": "model3_linear_curve_sensitivity",
  "description": "Sensitivity: Model 3 example heat-pump/chiller curves; not fitted to case-study equipment",
  "currency": "EUR",
  "carriers": {
    "electricity": {
      "primary_nonrenewable": 2.0,
      "primary_renewable": 0.4,
      "carbon_kgCO2e_per_kWh": 0.25,
      "import_price_per_kWh": 0.25,
      "export_primary_nonrenewable": 0,
      "export_primary_renewable": 0,
      "export_carbon_kgCO2e_per_kWh": 0,
      "export_price_per_kWh": 0.06,
      "source": "Illustrative test factors/prices, not national factors, tariffs or ISO validation"
    },
    "natural_gas": {
      "primary_nonrenewable": 1.1,
      "primary_renewable": 0,
      "carbon_kgCO2e_per_kWh": 0.2,
      "import_price_per_kWh": 0.09,
      "export_primary_nonrenewable": 0,
      "export_primary_renewable": 0,
      "export_carbon_kgCO2e_per_kWh": 0,
      "export_price_per_kWh": 0,
      "source": "Illustrative test factors/prices, not national factors, tariffs or ISO validation"
    },
    "district_heat": {
      "primary_nonrenewable": 1.0,
      "primary_renewable": 0,
      "carbon_kgCO2e_per_kWh": 0.15,
      "import_price_per_kWh": 0.1,
      "export_primary_nonrenewable": 0,
      "export_primary_renewable": 0,
      "export_carbon_kgCO2e_per_kWh": 0,
      "export_price_per_kWh": 0,
      "source": "Illustrative test factors/prices, not national factors, tariffs or ISO validation"
    },
    "other_fuel": {
      "primary_nonrenewable": 1.1,
      "primary_renewable": 0,
      "carbon_kgCO2e_per_kWh": 0.27,
      "import_price_per_kWh": 0.11,
      "export_primary_nonrenewable": 0,
      "export_primary_renewable": 0,
      "export_carbon_kgCO2e_per_kWh": 0,
      "export_price_per_kWh": 0,
      "source": "Illustrative test factors/prices, not national factors, tariffs or ISO validation"
    }
  },
  "technologies": {
    "zone_heating_s8": {
      "carrier": "natural_gas",
      "performance": {
        "coefficients": [
          0.912156819
        ],
        "temperature_min_C": -30,
        "temperature_max_C": 50,
        "out_of_range": "clip",
        "source": "supplied systems_templates.json / s8 / zone_heating"
      },
      "distribution_efficiency": 0.92,
      "emission_efficiency": 1.0,
      "regulation_efficiency": 0.882,
      "auxiliary_kWh_per_kWh_generated": 0.0,
      "description": "Traditional Gas Boiler, Centralized, Low Temp Radiator"
    },
    "ahu_heating_s8": {
      "carrier": "natural_gas",
      "performance": {
        "coefficients": [
          0.912156819
        ],
        "temperature_min_C": -30,
        "temperature_max_C": 50,
        "out_of_range": "clip",
        "source": "supplied systems_templates.json / s8 / ahu_heating"
      },
      "distribution_efficiency": 0.92,
      "emission_efficiency": 1.0,
      "regulation_efficiency": 1.0,
      "auxiliary_kWh_per_kWh_generated": 0.0,
      "description": "Traditional Gas Boiler, Centralized, Low Temp Radiator; AHU coil: generation/distribution only"
    },
    "zone_cooling_s1": {
      "carrier": "electricity",
      "performance": {
        "coefficients": [
          5.2,
          -0.09
        ],
        "temperature_min_C": -10,
        "temperature_max_C": 45,
        "out_of_range": "clip",
        "source": "Monthly_SS_simplified/model3/example_data/systems.csv configuration 2; illustrative transfer only"
      },
      "distribution_efficiency": 1.0,
      "emission_efficiency": 1.0,
      "regulation_efficiency": 1.0,
      "auxiliary_kWh_per_kWh_generated": 0.0,
      "description": "A-A split"
    },
    "ahu_cooling_s1": {
      "carrier": "electricity",
      "performance": {
        "coefficients": [
          5.2,
          -0.09
        ],
        "temperature_min_C": -10,
        "temperature_max_C": 45,
        "out_of_range": "clip",
        "source": "Monthly_SS_simplified/model3/example_data/systems.csv configuration 2; illustrative transfer only"
      },
      "distribution_efficiency": 1.0,
      "emission_efficiency": 1.0,
      "regulation_efficiency": 1.0,
      "auxiliary_kWh_per_kWh_generated": 0.0,
      "description": "A-A split; AHU coil: generation/distribution only"
    },
    "dhw_s8": {
      "carrier": "natural_gas",
      "performance": {
        "coefficients": [
          0.912156819
        ],
        "temperature_min_C": -30,
        "temperature_max_C": 50,
        "out_of_range": "clip",
        "source": "supplied systems_templates.json / s8 / dhw"
      },
      "distribution_efficiency": 0.92,
      "emission_efficiency": 1.0,
      "regulation_efficiency": 0.882,
      "auxiliary_kWh_per_kWh_generated": 0.0,
      "description": "Traditional Gas Boiler, Centralized, Low Temp Radiator"
    },
    "zone_heating_s19": {
      "carrier": "natural_gas",
      "performance": {
        "coefficients": [
          0.994771213
        ],
        "temperature_min_C": -30,
        "temperature_max_C": 50,
        "out_of_range": "clip",
        "source": "supplied systems_templates.json / s19 / zone_heating"
      },
      "distribution_efficiency": 0.97,
      "emission_efficiency": 1.0,
      "regulation_efficiency": 0.82,
      "auxiliary_kWh_per_kWh_generated": 0.0,
      "description": "Condensing Gas Boiler, Single, High Temp Radiator"
    },
    "ahu_heating_s19": {
      "carrier": "natural_gas",
      "performance": {
        "coefficients": [
          0.994771213
        ],
        "temperature_min_C": -30,
        "temperature_max_C": 50,
        "out_of_range": "clip",
        "source": "supplied systems_templates.json / s19 / ahu_heating"
      },
      "distribution_efficiency": 0.97,
      "emission_efficiency": 1.0,
      "regulation_efficiency": 1.0,
      "auxiliary_kWh_per_kWh_generated": 0.0,
      "description": "Condensing Gas Boiler, Single, High Temp Radiator; AHU coil: generation/distribution only"
    },
    "zone_cooling_s4": {
      "carrier": "electricity",
      "performance": {
        "coefficients": [
          5.2,
          -0.09
        ],
        "temperature_min_C": -10,
        "temperature_max_C": 45,
        "out_of_range": "clip",
        "source": "Monthly_SS_simplified/model3/example_data/systems.csv configuration 2; illustrative transfer only"
      },
      "distribution_efficiency": 0.97,
      "emission_efficiency": 1.0,
      "regulation_efficiency": 0.748,
      "auxiliary_kWh_per_kWh_generated": 0.0,
      "description": "A-W chiller, Single, Fan coil"
    },
    "ahu_cooling_s4": {
      "carrier": "electricity",
      "performance": {
        "coefficients": [
          5.2,
          -0.09
        ],
        "temperature_min_C": -10,
        "temperature_max_C": 45,
        "out_of_range": "clip",
        "source": "Monthly_SS_simplified/model3/example_data/systems.csv configuration 2; illustrative transfer only"
      },
      "distribution_efficiency": 0.97,
      "emission_efficiency": 1.0,
      "regulation_efficiency": 1.0,
      "auxiliary_kWh_per_kWh_generated": 0.0,
      "description": "A-W chiller, Single, Fan coil; AHU coil: generation/distribution only"
    },
    "dhw_s19": {
      "carrier": "natural_gas",
      "performance": {
        "coefficients": [
          0.994771213
        ],
        "temperature_min_C": -30,
        "temperature_max_C": 50,
        "out_of_range": "clip",
        "source": "supplied systems_templates.json / s19 / dhw"
      },
      "distribution_efficiency": 0.97,
      "emission_efficiency": 1.0,
      "regulation_efficiency": 0.82,
      "auxiliary_kWh_per_kWh_generated": 0.0,
      "description": "Condensing Gas Boiler, Single, High Temp Radiator"
    },
    "zone_heating_s36": {
      "carrier": "electricity",
      "performance": {
        "coefficients": [
          2.2,
          0.09
        ],
        "temperature_min_C": -10,
        "temperature_max_C": 35,
        "out_of_range": "clip",
        "source": "Monthly_SS_simplified/model3/example_data/systems.csv configuration 2; illustrative transfer only"
      },
      "distribution_efficiency": 0.97,
      "emission_efficiency": 1.0,
      "regulation_efficiency": 0.862,
      "auxiliary_kWh_per_kWh_generated": 0.0,
      "description": "A-W Heat Pump, Single, Fan coil"
    },
    "ahu_heating_s36": {
      "carrier": "electricity",
      "performance": {
        "coefficients": [
          2.2,
          0.09
        ],
        "temperature_min_C": -10,
        "temperature_max_C": 35,
        "out_of_range": "clip",
        "source": "Monthly_SS_simplified/model3/example_data/systems.csv configuration 2; illustrative transfer only"
      },
      "distribution_efficiency": 0.97,
      "emission_efficiency": 1.0,
      "regulation_efficiency": 1.0,
      "auxiliary_kWh_per_kWh_generated": 0.0,
      "description": "A-W Heat Pump, Single, Fan coil; AHU coil: generation/distribution only"
    },
    "zone_cooling_s2": {
      "carrier": "electricity",
      "performance": {
        "coefficients": [
          5.2,
          -0.09
        ],
        "temperature_min_C": -10,
        "temperature_max_C": 45,
        "out_of_range": "clip",
        "source": "Monthly_SS_simplified/model3/example_data/systems.csv configuration 2; illustrative transfer only"
      },
      "distribution_efficiency": 0.97,
      "emission_efficiency": 1.0,
      "regulation_efficiency": 0.748,
      "auxiliary_kWh_per_kWh_generated": 0.0,
      "description": "A-W chiller, Centralized, Fan coil"
    },
    "ahu_cooling_s2": {
      "carrier": "electricity",
      "performance": {
        "coefficients": [
          5.2,
          -0.09
        ],
        "temperature_min_C": -10,